{"backup_identity_digest":"sha-256:cccccccccccccccccccccccccccccccccccccccccccccccccccccccccccccccc","custodian_reference":"custodian:event","detached_signature":"AAAAAAAAAAAAAAAAAAAAAAAAAAAAAAAAAAAAAAAAAAAAAAAAAAAAAAAAAAAAAAAAAAAAAAAAAAAAAAAAAAAAAA","domain":"event","evidence_time":"2026-08-04T00:00:00.000Z","intent_digest":"sha-256:aaaaaaaaaaaaaaaaaaaaaaaaaaaaaaaaaaaaaaaaaaaaaaaaaaaaaaaaaaaaaaaa","method":"generation_retired","obligation_digest":"sha-256:16606523e2988535d48211dc7212be1aa37b30a3a2031adf683b377238382564","operation_id":"0198cf64-cc00-7000-8000-000000000001","outcome":"success","policy_digest":"sha-256:bbbbbbbbbbbbbbbbbbbbbbbbbbbbbbbbbbbbbbbbbbbbbbbbbbbbbbbbbbbbbbbb","profile":"yukh-transcript-backup-custodian-receipt/v0.1","receipt_id":"0198cf64-cc00-7000-8000-000000000002","signature_algorithm":"ed25519","verification_key_id":"backup-key-1"}