{"profile":"yukh-transcript-backup-custodian-receipt/v0.1","receipt_id":"0198cf64-cc00-7000-8000-000000000002","domain":"event","outcome":"success","method":"generation_retired","operation_id":"0198cf64-cc00-7000-8000-000000000001","obligation_digest":"sha-256:16606523e2988535d48211dc7212be1aa37b30a3a2031adf683b377238382564","intent_digest":"sha-256:aaaaaaaaaaaaaaaaaaaaaaaaaaaaaaaaaaaaaaaaaaaaaaaaaaaaaaaaaaaaaaaa","policy_digest":"sha-256:bbbbbbbbbbbbbbbbbbbbbbbbbbbbbbbbbbbbbbbbbbbbbbbbbbbbbbbbbbbbbbbb","backup_identity_digest":"sha-256:cccccccccccccccccccccccccccccccccccccccccccccccccccccccccccccccc","evidence_time":"2026-08-04T00:00:00.000Z","custodian_reference":"custodian:event","verification_key_id":"backup-key-1","signature_algorithm":"ed25519","detached_signature":"AAAAAAAAAAAAAAAAAAAAAAAAAAAAAAAAAAAAAAAAAAAAAAAAAAAAAAAAAAAAAAAAAAAAAAAAAAAAAAAAAAAAAA"}
